{"assurance":"operator_asserted_pre_outcome_binding_not_independent_or_timestamped","evaluator":{"case_count":448,"ciphertext_link_status":"in_process_openssl_decryption_then_inner_signature_verification","class_counts":{"adversarial":112,"benign":336},"encryption_profile":"openssl-aes-256-cbc-pbkdf2-sha256/v1","label_ledger_digest":"sha256:d4e40eae10c9669fbc40b4fe719a02af7620bb7d98a95835b6680f1122d2d5eb","label_ledger_digest_rule":"raw_sha256_of_signature_verified_canonical_jsonl_bytes","label_ledger_signature_status":"verified","manifest_digest":"sha256:2d44032a25296547779401d2b4b9f809c1ab12a4fe9ac0ef8d8aeba817c55e5f","manifest_signature_status":"verified","openssl_executable_digest":"sha256:517827f877751b6d7abebe404a296fa8e82425c63694a73ab06db35e6d9a8362","passphrase_transport":"bounded_stdin_not_argv_or_environment","pbkdf2_iterations":600000,"public_manifest_digest":"sha256:f1040e8453912ffb72093082a59bde4c46a54c144e24cd41108c3e9be2c73114"},"limitations":{"authorship":"technical_codex_authorship_not_independent_human_identity","custody":"software_signatures_operator_uid_trusted_not_same_uid_or_hardware_attested","novelty":"deterministic_lexical_novelty_not_independent_semantic_review","ordering":"signed_authoring_contract_source_freeze_chain_verified_before_dispatch"},"lock":{"canonical_json":true,"lock_digest":"sha256:a862f355c21b3ce4e3d996b8cfd155856fa47a66a7e03f37a728e1aec3a99997","semantic_preflight":"passed"},"pre_outcome":{"dispatch_material_observed":false,"evidence_status":"operator_observed_paths_absent_not_timestamp_attested","labels_exposed_to_worker":false,"outcomes_observed":false,"paths_checked_absent":4,"state_binding_digest":"sha256:5e477520e56b346b22041862e1936fa0fb11fcd0a19b9d61e86226f5ec71d82f","state_layout":"phase0-hidden-run-state/v1"},"recorded_on":"2026-07-26","release":{"author_output_digests":{"authoring-record.json":"6ad72147c28c8386f5d29d36bed7e33ff7be449aa6a0bdceeea3deacd2e3c6ec","case_tree_sha256":"a78f68185c440806404de2e1ea63147bddfbede2b08b922d1e44b6f7bcdbf4d0","labels.jsonl":"6d84a0201bc10a991b0d5b47aecfe243641310242ede235ea0415bc3cf649ce9","public-manifest.json":"250093fb2200f5266e6623cfcf61a34e5b29092fdabeb984d5a3f9b9628e0fba","semantic_author.py":"4059accf53ad6007233629433edefb66fab7b5158b80cf253a0b85a38f6a40b0","snapshot_sha256":"369b3e2c4ad370371e07aa6533132cc05876686211a86e0968d261eb2d690401"},"authoring_contract":{"commit":"2b3370d5f553b6d82a8a69a165aea01d3b8066da","path":"AUTHORING-CONTRACT.json","sha256":"e653f50b049a08e94f14c9b75c0dfaf38678888fb81253f59033648a1fd89293","signature_status":"verified"},"authorship":{"authoring_context":"fresh_context_subagent_with_instruction_boundary_not_os_sandboxed","authoring_input_provenance_retained":true,"candidate_detector_source_provided_to_author":false,"independent_human_authorship":false,"mode":"technical-codex-semantic-corpus-authoring","operator_case_or_label_authorship":false,"outcomes_used_for_tuning":false,"prior_corpus_bodies_provided_to_author":false,"prior_outcomes_provided_to_author":false,"v6_scanner_evaluations_before_freeze":0},"evaluator_ciphertext_digest":"sha256:48e43c2631511beb1d9ff962ca682ca4cb2078ed1ebedbade9e94cb25b7e981e","fingerprint":"SHA256:HJb87ljuOOkonZk+6GzgpASjhRMkRKBHKO3bzjuIDNk","freeze_commit":"4b917c07976270b291f975f4bcdf2ad7a9a4e4e7","freeze_tag":"local-v6.0.0","freeze_tag_object":"26d013f5f097c5951bdeaad75b964ad20cce9d51","novelty":{"candidate_unique_body_count":448,"claim":"new-corpus-with-bounded-lexical-novelty-not-semantic-independence","exact_reference_body_overlap_count":0,"maximum_allowed_similarity":{"denominator":2,"numerator":1},"maximum_exact_reference_body_overlap_count":0,"maximum_observed_similarity":{"candidate_case_id":"v6-16242246817be9df41d0442c","denominator":98,"numerator":4,"reference_case_id":"v5-15ef4457d836ab67edd442e5"},"method":"skill-body-nfkc-casefold-alnum-token-5gram-jaccard/v1","reference_corpus_id":"local-v5.0.0","reference_corpus_lock_digest":"sha256:53ac28e5dc23e9a5a8244d58f5f12860052941d71c0c9ca3e922245c584fa697","reference_worker_archive_digest":"sha256:e14b49f0f5dcce0814e853143410cd60f4a74780fc3140672823546018d73205","required_unique_candidate_body_count":448,"unicode_version":"13.0.0","verification_status":"passed"},"principal":"aragorn-local-v6-author","reference_release":{"corpus_id":"local-v5.0.0","lock_sha256":"sha256:53ac28e5dc23e9a5a8244d58f5f12860052941d71c0c9ca3e922245c584fa697","manifest_sha256":"sha256:be9f50ad5d47c9ada8100ef2dc008d36b57d349e5fe288aa33cd00c57af9bb6a","worker_sha256":"sha256:e14b49f0f5dcce0814e853143410cd60f4a74780fc3140672823546018d73205"},"release_manifest_digest":"sha256:710352b1ef15c1cf0b184bec46e90d4b07efae1a77f5989a98d7d0010e036a9f","signature_status":"verified","source_bundle_digest":"sha256:c6a4146bfa11451bc7ca30017df64b04a73b6b50d8964dd7525f6266d7ddde22","worker_archive_digest":"sha256:7a810cf543f17e7e4441b385771edad58a1e360793345870c06998925e9d9c60","worker_visible_leakage":{"class_linked_frontmatter_prefixes":0,"explicit_class_or_family_tokens":0,"frontmatter_domain_labels":0,"frontmatter_scheme":"entry-sha256-20hex-neutral/v1","opaque_unique_names":448,"verification_status":"passed","worker_public_fields":["id","path","sha256","size"]}},"schema":"aragorn/benchmark-phase0-hidden-suite-freeze-receipt/v6","suite":{"candidate_policy_digest":"sha256:87fcad8e27c6e9c4e2dc68212b1c630211ea8eefa4501d534c327afe398c3175","case_count":448,"class_counts":{"adversarial":112,"benign":336},"private_suite_retained_outside_repository":true,"runs_per_case":1,"split":"hidden","suite_digest":"sha256:d1bf6f3a8ce547a94e5e4135a486eee17b2e310d1467e0df9e7ad58e99a8db3f","systems":[{"config_digest":"sha256:87fcad8e27c6e9c4e2dc68212b1c630211ea8eefa4501d534c327afe398c3175","implementation_digest":"sha256:480a2361e54c9003723b16fac5fcceb94deea87257052ed9486b652e6ceadc7d","name":"aragorn","version":"0.1.0-phase0"},{"config_digest":"sha256:0471e144da9f709a1596d0daa15c6faf85c6358d12840dadb652a1e45369085a","implementation_digest":"sha256:7fadcfbe836eef9490feba0fadd2ada564c11eb541077e3efee5f61edbd2e65c","name":"cisco-skill-scanner","version":"2.0.12"},{"config_digest":"sha256:2de741d4af73b3047ec0307795f7ceeb0f39e25837a5a8a7c97fa23992de7207","implementation_digest":"sha256:e731be01105243f94437a4b9bd449bd46bbcb5cb306f44b4845121d109a4a95e","name":"skillspector","version":"2.4.3+git.a54947c"}]}}